<!ELEMENT example (#PCDATA)>
<!ELEMENT description (#PCDATA)>
<!ELEMENT lenguaje (description,example)>
<!ELEMENT programmingLanguages (lenguaje)+>
<!ATTLIST lenguaje name CDATA #REQUIRED>